{"$schema":"https://json-schema.org/draft/2020-12/schema","$id":"https://anomaly.local/gmcp-contract/1.1.0/Anomaly.Room.Info.json","title":"Anomaly.Room.Info","description":"Snapshot on room entry (after Session.Reset scope room) and on change. Darkness and blindness do not hide it (revision 3 data policy).","x-direction":"s2c","x-frozen":false,"type":"object","properties":{"room":{"type":"string","pattern":"^[0-9]+,[0-9]+$","description":"map,room as `rm` prints it"},"map":{"type":"integer"},"mapName":{"type":"string"},"zone":{"type":["string","null"]},"name":{"type":"string"},"description":{"type":"string"},"light":{"type":"integer"},"roomType":{"type":"integer"},"flags":{"type":"array","items":{"type":"string"}},"spell":{"type":["integer","null"]},"exits":{"type":"array","items":{"type":"object","properties":{"dir":{"type":"string","enum":["n","s","e","w","ne","nw","se","sw","u","d"]},"to":{"type":"string","pattern":"^[0-9]+,[0-9]+$","description":"map,room as `rm` prints it"},"kind":{"enum":["normal","door","gate","key","hidden","text","level","class","race","alignment","toll","map","item"]},"hidden":{"type":"boolean"},"found":{"type":"boolean"},"door":{"oneOf":[{"type":"null"},{"type":"object","properties":{"state":{"enum":["open","closed","locked"]},"key":{"type":["integer","null"]},"bashable":{"type":"boolean"}},"required":["state","key","bashable"],"additionalProperties":false}]},"gate":{"oneOf":[{"type":"null"},{"type":"object","properties":{"minLevel":{"type":["integer","null"]},"maxLevel":{"type":["integer","null"]},"class":{"type":["integer","null"]},"race":{"type":["integer","null"]},"alignment":{"type":["string","null"]},"item":{"type":["integer","null"]}},"required":["minLevel","maxLevel","class","race","alignment","item"],"additionalProperties":false}]},"toll":{"type":["integer","null"]},"phrase":{"type":["string","null"]}},"required":["dir","to","kind","hidden","found","door","gate","toll","phrase"],"additionalProperties":false,"description":"Every exit, hidden and unfound included (flagged). door.key = the item number that opens it. toll in copper. phrase = a text exit's words."}}},"required":["room","map","mapName","zone","name","description","light","roomType","flags","spell","exits"],"additionalProperties":false}
