{"room":"1,2","map":1,"mapName":"Silvermere","zone":"Silvermere","name":"North Road","description":"A cobbled road.","light":100,"roomType":0,"flags":[],"spell":null,"exits":[{"dir":"s","to":"1,1","kind":"normal","hidden":false,"found":true,"door":null,"gate":null,"toll":null,"phrase":null},{"dir":"n","to":"1,300","kind":"door","hidden":false,"found":true,"door":{"state":"locked","key":338,"bashable":true},"gate":null,"toll":null,"phrase":null}]}
